monument,location,Description,start_from,end_at,tickets_price
Pyramid Complex of Menkaure,Giza Plateau,"Menkaure (Mykerinos to the ancient Greeks; c.2532–2503 BC) is the builder of the third of the three large Giza Pyramids. He was most likely the son of Khafre (Khefren), and grandson of Khufu (Cheops). With a base area that is less than a quarter of their pyramids’, and with an original height of 65 meters, Menkaure’s is by far the smallest of the three. This reduction in size is due to several factors, including the limited amount of space left on the Giza Plateau. The material used for the outer casing of Menkaure’s pyramid is another. Whereas his predecessors had used limestone for this purpose, Menkaure employed granite, which was quarried in Aswan, over 800 km away. In addition to the logistics involved in transportation of the granite blocks, the material itself is much harder than limestone. However, only the bottom quarter of the casing stones are made of granite however, the rest being limestone.
Like the Great Pyramid, three smaller pyramids can be seen next to Menkaure’s as well, which were used for the burials of his queens. No satellite pyramid has been discovered, however, but it is believed that the largest of the three queens’ pyramids was in fact originally intended to have been the satellite pyramid.
 Menkaure died before his pyramid complex was completed, and much of the pyramid’s granite casing blocks were not smoothed. His mortuary and valley temples were intended to consist of colossal limestone blocks encased in granite, but were actually completed with whitewashed mud brick. Despite this, however, the mortuary cult of Menkaure was practiced for another 300 years after his death.",07:00 AM,05:00 PM,"FOREIGNERS:
Adult: EGP 280/ Students: EGP 140
AREA ENTRY TICKET REQUIRED

EGYPTIANS:
Adult: EGP 30 / Students: EGP 10
AREA ENTRY TICKET REQUIRED"
Tomb of Khufukhaf I,Giza Plateau,"The mastaba tomb of Khufukhaf I is located in the Eastern Cemetery of the complex of the Great Pyramid of king Khufu (c.2589–2566 BC) at Giza. This cemetery was reserved for the closest relatives of the king, and contains some of the largest mastabas on the Giza Plateau. The term mastaba (Arabic for “bench”) refers to a type of funerary structure that was generally rectangular in shape and built over the tomb proper, which was underground. The mastaba of Khufukhaf I includes two burial shafts, one for him, and another for his wife, Neferetkau.
The chapel of Khufukhaf I, inside the mastaba, where his funerary cult was conducted, is very well preserved. Many beautiful scenes survive that show him and his wife receiving a wide variety of offerings, which they would both need in the afterlife.
A scene in the chapel depicts him holding his mother’s hand. The hieroglyphic inscriptions beside her reveal that she was the mother of a king, but her name is missing. It is thought that this is Henutsen, one of Khufu’s wives, who is believed to have been buried in one of the three queens’ pyramids next-door. The inscriptions in Khufukhaf I’s mastaba also identify him as a vizier, the highest-ranking official in ancient Egyptian administration. As a vizier and the son of a queen, there is no doubt that Khufukhaf I was one of the most powerful people in the kingdom during his lifetime.",07:00 AM,05:00 PM,Free
Workers’ Town and Cemetery,Giza Plateau,"The remains of a large settlement site, known as Heit al-Ghurab, were discovered in the southeastern area of the Giza Plateau. This was where the workers who built the pyramid complexes of Khafre (c.2558–2532 BC) and Menkaure (c.2532–2503 BC) lived. The tantalizing  remains of an even older settlement underneath may date to Khufu’s reign (c.2589–2566 BC). Houses, magazines, three main streets, and a royal administrative building were discovered within the city walls, as were four huge galleries. These may have been the barracks in which the workers who built the pyramids slept and prepared their food. An enormous amount of fish, bird, cattle, sheep, goat, and pig bones were found, revealing that the state ensured that the workers were in good health so they could fulfill their physically demanding responsibilities.
On the hillside immediately to the west of Heit al-Ghurab is the town’s cemetery. Low-ranking overseers of workmen were buried in modest mastabas on the low slopes of the hill, surrounded by even smaller mastaba or domed tombs, possibly those of their extended families and the workers they supervised. These were largely built of mudbrick, whereas the higher-ranking overseers and skilled craftsmen were buried in large stone mastabas higher up the slope. Among these is the beautifully decorated tomb of the overseer of linen, the overseer of the royal house of purification, Nefertheith. The majority of the bodies discovered show evidence of hard physical labor, many even featuring broken bones. Most of these had healed correctly, however, indicating that, in addition to being well-fed, the workers also received very good medical care.",07:00 AM,05:00 PM,"FOREIGNERS: EGP 700
AREA ENTRY TICKET REQUIRED

EGYPTIANS: EGP 350
AREA ENTRY TICKET REQUIRED"
Eastern and Western Cemeteries,Giza Plateau,"Two of the largest preserved Old Kingdom cemeteries form a part of the pyramid complex of king Khufu (c.2589–2566 BC) in Giza. Called the Eastern and Western Cemeteries after their positions relative to the Great Pyramid, they include the tombs of members of the royal family and the highest-ranking nobles. As such, they contain some of the most beautiful tomb decorations from this period.
The cemeteries consist mostly of mastabas, but rock-cut tombs are attested as well. The term mastaba (Arabic for “bench”) refers to a type of funerary structure that was generally rectangular in shape and built over the tomb proper, which was underground. Most of the mastabas of the Eastern and Western Cemeteries were built during the reign of Khufu, in tandem with his pyramid complex, whereas the rock-cut tombs were for the most part built later.
Most of the tombs of the Eastern Cemetery dating to the reign of Khufu were intended for his closest relatives. The rock-cut tomb of his mother, queen Hetepheres I, along with her funerary equipment, was discovered here, and it is the site of the mastaba of his half-brother Ankh-haf, who had an important administrative position in the construction of the Great Pyramid. On the other hand, the mastabas of the Western Cemetery, which are mostly arranged in an orderly grid, were reserved for very high-ranking noblemen that were not as closely related to the king. Among them is the monumental mastaba of Hemiunu, who oversaw the building of the Great Pyramid.",07:00 AM,05:00 PM,Free
Tomb of Queen Meresankh III,Giza Plateau,"Under the shadow of the Great Pyramid lies the mastaba of Queen Meresankh III, the wife of Khafre and granddaughter of Khufu. Both very large and exquisitely decorated, this is indeed a tomb worthy of her rank and fortunately also contains the best preserved wall reliefs in the Eastern Cemetery.
These are decorated with a diverse array of scenes, including bread baking, beer brewing, fowling, herding, mat making, metal smelting, and the sculpting of statues, apparently of Meresankh herself. These, along with the elaborate scenes of offering-bearers bringing all sorts of gifts to Meresankh, were intended to magically provide her soul with a continuous stream of food and goods in the afterlife. Interestingly, among the objects being brought to her are a canopy with a bed being set up within it, an armchair, and a carrying chair. Actual examples of very similar objects were discovered in the tomb of Hetepheres I, the mother of Kufu, and can be seen today at the Egyptian Museum in Cairo.
Among the most striking features of Meresankh’s tomb chapel is a series of ten large statues of women that are carved out of the northern wall. It is believed that they represent, in addition to Meresankh herself, her mother, and daughters as well.",07:00 AM,05:00 PM,"FOREIGNERS:
Adult: EGP 200/ Student: EGP 100
AREA ENTRY TICKET REQUIRED

EGYPTIANS:
Adult: EGP 20 / Student: EGP 5
AREA ENTRY TICKET REQUIRED"
The Step Pyramid Complex of Djoser,Saqqara,"Djoser’s Step Pyramid in Saqqara is one of Egypt’s most iconic monuments—and rightfully so. It constitutes a significant historical turning point in ancient Egyptian funerary monuments, revolutionizing stone architecture and royal burials. In addition to its beauty and monumental scale, it is not only the very first pyramid that the ancient Egyptians ever built, but also the oldest known ancient Egyptian stone structure.
The sheer age of the Step Pyramid is astounding. It was built in the early Third Dynasty, during the reign of King Netjerykhet (c.2667–2648 BC), who is now more well-known as Djoser.
Before his reign, royal and elite Egyptians were buried in mastabas. This word, meaning “bench” in Arabic, refers to a type of funerary structure that was generally rectangular in shape and built over the tomb proper, which was underground. The Step Pyramid is composed of six stacked mastabas, thus creating the stepped effect. Imhotep, its architect, may very well have been responsible for this major innovation.
At one end of the pyramid complex, a structure known as the South Tomb is believed to have acted as an additional, symbolic, tomb for Djoser, perhaps reflecting his role as the dual king of both Upper and Lower Egypt.
Djoser’s pyramid complex also has some unique features. The two courts in front of the pyramid recreate the setting of the Sed Festival, a royal ceremony aimed at rejuvenating the king and regenerating his power. The structures on the side of the eastern court emulate in stone the ephemeral shrines that were used in this festival, thus ensuring that the king could continue being rejuvenated forever.",08:00 AM,05:00 PM,"FOREIGNERS:
- Pyramid of Djoser:
Adult: EGP 150 / Student: EGP 75

EGYPTIANS:
- Pyramid of Djoser:
Adult: EGP 40 / Student: EGP 20"
Pyramid Complex of Teti,Saqqara,"Teti (c.2345–2323 BC), the first ruler of the Sixth Dynasty, built his pyramidal complex not far from the Step Pyramid of Djoser (c.2667–2648 BC), in Saqqara. Upon completion, it stood 52.5 m tall. Although it was originally encased in blocks of fine limestone, its core consists of small blocks of local limestone and debris fill. This meant that, when the casing blocks were removed in antiquity, the core, unable to sustain its shape, began to droop. The pyramid appears little different from a natural hill today as a result. Its substructure, however, is intact.
          A descending passageway turns into a horizontal corridor, which leads to an antechamber. Three magazines for burial equipment lie on the left, but since the pyramid was robbed in antiquity, these were found empty. On the right, west, side is the burial chamber. Its ceiling is decorated with gold stars against a dark blue background, reflecting the ancient Egyptian notion of the tomb as a microcosm of the universe. The end of the corridor, and the entirety of the antechamber and burial chamber are beautifully decorated with Pyramid Texts. These are a collection of rituals and recitations that were designed to ensure the king’s successful journey to the afterlife. The originally intended decorative programme was never completed, however, indicating the king’s untimely death. The third century BC ancient Egyptian priest and historian Manetho recorded that Teti was killed by his bodyguards, but there is little evidence to support this.
         Some fragments have been discovered of the mortuary temple of Teti’s pyramid complex despite the fact that most of its blocks were robbed in antiquity. His valley temple has not been located yet. A large cemetery for the burials of Teti’s officials lies in front of his pyramid. Some of the grandest and most beautifully decorated tombs of the Old Kingdom are located here, such as the mastabas of the viziers Mereruka and Kagemni.",08:00 AM,05:00 PM,Free
Hammam of Sultan Inal,Al-Mu'izz Street,"Sultan al-Ashraf Abu al-Nasr Sayf al-Din Inal commissioned this bathhouse in 861 AH / 1456 AD, during the Mamluk Period. The structure was an important social institution. Like the architecture of Islamic bathhouses, the dog-leg corridor just beyond the entrance gives privacy and opens onto a cool room. Here, customers removed their clothes and prepared to bathe, where a number of seating areas and lockers for keeping personal belongings.
From here they went into the warm room, where they could rest and enjoy refreshments before entering the steamed basin room. They left the same way they came out, adjusting their body temperature with the changing atmosphere of each chamber.
The domes punctured with apertures of stained glass contributed to temperature regulation to circulate warm air and illuminate the building. The bathhouse got its water from a well through a waterwheel (saqiya), which raised this water to the furnace at the back of the building. Waste was burned in the furnace, which thus warmed the water in a large container that was then pumped to the different parts of the bath through pottery pipes and metal spouts.",09:00 AM,04:00 PM,"FOREIGNERS:
Area entry:
Adult: EGP 220 / Student: EGP 110
EGYPTIANS:
Adult: EGP 20 / Student: EGP 10

Inclusive tickets allowing entry into the site,Qalawun Group, Suleyman Agha Al-Selehdar Mosque and Sabil , Al-Kamil School, Al-Nasir Muhammad Ibn Qalawun Mosque and School, Sultan Barqouk Mosque, Musa Bin Maimun Temple, Hammam Inal, Amir Bishtak Palace .

This ticket does not cover Wekalet Bazaraa and Bayt Al-Suhaymi, Their prices are listed on their individual pages."
Pyramid of Unas,Saqqara,"The pyramid of Unas was built in the 5th Dynasty. Despite its size, this pyramid is very significant for having the first example of funerary texts known as Pyramid Texts. These texts were inscribed on the walls of the burial chamber and assisted the deceased pharaoh in his journey to the afterlife through instructive spells.
As with most pyramids, two temples linked by a long causeway compose part of the pyramid complex. The remains of the valley temple can be seen at the modern entrance to the site of Saqqara. Much of the causeway, which was elaborately decorated, has been removed and reused by later kings, but a part of it still remains offering visitors a glimpse of what it once looked like.",08:00 AM,05:00 PM,Free
Serapeum,Saqqara,"The Serapeum at Saqqara is the tomb of the sacred Apis bulls that were associated with the god Ptah, whose cult center was in Memphis. An avenue of sphinxes leads to the Serapeum, which is composed of two long corridors that once housed the mummified remains of the bulls. The tomb was in use from the time of Amenhotep III in the New Kingdom through to the Ptolemaic Period.
Priests selected certain bulls based on their markings and divine birth. The bulls were treated with a lot of privilege during their life. Upon death, the bulls were mummified and placed in sarcophagi in an elaborate celebration.
Inscriptions record many kings who made offerings in the Serapeum. Two sons of Ramses II, Khaem-waset and Meren-ptah, donated several bulls, jewelry and shabtis as princes and High Priests of Ptah.",08:00 AM,05:00 PM,"FOREIGNERS:
Adult: EGP 180 / Student: EGP 90

EGYPTIANS:
Adult: EGP 20 / Student: EGP 5"
Tomb of the Two Brothers Niankh‑Khnum and Khnumhotep,Saqqara,"The so-called Tomb of the Two Brothers is among the largest and most magnificently decorated in Saqqara. It belongs to Niankh-Khnum and Khnumhotep, both of whom held the titles “overseer of the manicurists of the Great House” and “prophet of Re at the Sun-temple of Niuserre” a Fifth-Dynasty king (c.2445–2421 BC). The tomb is a mastaba (Arabic for “bench”), a type of funerary structure that was generally rectangular in shape and built over the tomb proper, which was underground. The chapel of the tomb, where the cult of the tomb owners would be practiced, was generally located within the mastaba itself. Here, in addition to the chapel rooms within the mastaba, a part of it was cut out of the rock.
The walls of the tomb are decorated with lively scenes of fishing with nets and spears, agriculture, butchery, gardening, carpentry, and jewelry-making. Another scene depicts a banquet during which both tomb owners are entertained by singers and dancers while musicians play their instruments. In an interesting tribute to the Two Brothers’ own profession, another scene shows barbers, manicurists and pedicurists at work.
One particular scene, which is generally reserved for a man and his wife, depicts Niankh-Khnum and Khnumhotep in an intimate scene, standing close to one another. This, combined with the fact that they were both buried in the same tomb, has led to much speculation. Due to several factors, including the fact that each of them is represented with his wife, it is believed that Niankh-Khnum and Khnumhotep were identical twins.",08:00 AM,05:00 PM,Free
Tomb of Mereruka,Saqqara,"Mereruka was vizier during the reigns of Kings Teti (c.2345–2323 BC). As vizier, the highest-ranking official, and husband of a daughter of Teti’s, Mereruka was a very powerful and wealthy man. It is all the more significant that he held this title during the reigns of the first two rulers of the Sixth Dynasty, a time when the elite’s power had grown substantially.
Mereruka was buried in a mastaba to the north of the pyramid of Teti in Saqqara. Reflecting his status, it is among the largest in the Teti cemetery, and among the most exquisitely decorated tombs of the Old Kingdom (c.2686–2181 BC). The rooms inside the mastaba were often the venue for the performance of the cult for the soul of the tomb owner. Mereruka’s massive mastaba contains a total of thirty rooms, including six for his wife, and another five for his son.
Many beautiful scenes adorning the walls of this tomb provide insight into life during the Old Kingdom, such as the herding of cattle, the harpooning of hippopotami, and fishing and fowling scenes, all of which are shown in amazingly vivid detail. Also shown are scenes of animals being force-fed, although exceptionally hyenas are depicted among them. A unique scene depicts personifications of the three seasons of the ancient Egyptian calendar. The focal point of the entire tomb was the false-door. In Mereruka’s mastaba, a life-size statue of him steps out, ready to receive the offerings that were set on the offering table before him.",08:00 AM,05:00 PM,"FOREIGNERS:
Adult: EGP 100 / Student: EGP 50

EGYPTIANS:
Adult: EGP 20 / Student: EGP 5"
New Kingdom Cemetery,Saqqara,"The vast necropolis of Saqqara, which served as the cemetery of ancient Memphis, contains tombs from almost every period of Egyptian history. The New Kingdom (c.1550–1069 BC) cemetery south of the causeway of Unas is where several important officials of the Eighteenth to Twentieth Dynasties were buried. Among them are Ptahemwia, the “Royal Butler, Clean of Hands” under Kings Akhenaten (c.1353–1336 BC) and Tutankhamun (c.1336–1327 BC), Maya, the overseer of the treasury under Tutankhamun, and Tia, the overseer of the treasury during the reign of Ramses II (c.1279–1213 BC). This is also the site of the tomb Horemheb was planning for himself before he became king.
Like most private tombs, the tombs of this New Kingdom cemetery consist of two parts: a sealed underground section that includes the burial chamber, and the above-ground, accessible, tomb chapel, where the cult of the deceased was practiced. What sets the tombs of this cemetery apart, however, is the fact that they are neither mastabas nor rock-cut, but free-standing structures known as temple-tombs. The larger tombs, like the great state temples of the period (hence their name), were entered through a pylon gateway that led into an open-air courtyard that preceded the tomb chapel. The central chapel would have been surmounted by a small pyramid, a symbol of rebirth. A shaft in the forecourt led to the underground burial chamber.
This section of Saqqara was explored by tomb robbers and art dealers in the 19th century. Many statues and reliefs were taken without being recorded, and sold to museums and collectors abroad. A 19th century map of the area made by Prussian Egyptologist Karl R. Lepsius led to the rediscovery of the New Kingdom cemetery in 1975 by the Anglo-Dutch expedition of the Egypt Exploration Society (EES) in London and the National Museum of Antiquities, Leiden, led by Geoffrey T. Martin.",08:00 AM,05:00 PM,"FOREIGNERS:
Tomb of Horemheb + Nobles Tombs + New Kingdom Tombs:
Adult: EGP 220 / Student: EGP 110

EGYPTIANS:
Tomb of Horemheb + Nobles Tombs + New Kingdom Tombs:
Adult: EGP 20 / Student: EGP10"
Tomb of Horemheb,Saqqara,"Horemheb (c.1323–1295 BC) was the last king of the Eighteenth Dynasty. Prior to his ascension to the throne, during the reign of Tutankhamun (c.1336–1327 BC), he was the highest-ranking military officer in the realm, and held other titles as lofty as “the King’s Deputy in the Entire Land”. He was ultimately buried in the Valley of the Kings as would befit his royal status. Before this, however, Horemheb had naturally begun work on another tomb, in Saqqara.
This tomb is the largest in the New Kingdom cemetery south of the causeway of the Fifth Dynasty King Unas (c.2375–2345 BC). Like the other major tombs in this cemetery, it is a temple-tomb, so named because it reflects the structure of contemporary great state temples. It is entered through a pylon gateway preceding two open-air courtyards that themselves precede the inner rooms of the chapel, where Horemheb’s cult was practiced. The central room was surmounted by a pyramid, a solar symbol of rebirth. The burial chamber was underground, accessed through a vertical shaft cut through the floor of the inner courtyard. The discovery of the bones of a fetus along with a female skeleton, possibly of Horemheb’s wife Mutnedjmet, in his Memphite tomb shows that it did not go unused.
The reliefs in this tomb include scenes depicting Horemheb carrying out his duties. One scene shows representatives of foreign rulers pleading before Tutankhamun, with Horemheb acting as intermediary. Two scenes in particular show his exalted status prior to his rise to kingship. Here, he is depicted followed by rows of foreign captives, being publicly rewarded with the Gold of Honor by Tutankhamun himself. The Gold of Honor was awarded by kings to their officials for exceptional service. The tomb is decorated with funerary scenes as well, one of which depicts the Opening of the Mouth ritual.
The location of this tomb was not always known. It was discovered in the early 19th century, when this area of Saqqara was explored by tomb-robbers and art dealers, who then sold their findings to museums and collectors abroad. These were not limited to statues and other portable objects. Entire sections of wall relief were removed, and none of the provenance was recorded. Horemheb’s Memphite tomb was particularly affected, and its location was subsequently forgotten. Thankfully, it and the New Kingdom cemetery were eventually rediscovered in 1975.
 ",08:00 AM,05:00 PM,"FOREIGNERS:
Tomb of Horemheb + Nobles Tombs + New Kingdom Tombs:
Adult: EGP 220 / Student: EGP 110

EGYPTIANS:
Tomb of Horemheb + Nobles Tombs + New Kingdom Tombs:
Adult: EGP 20 / Student: EGP 10"
Baron Empain Palace,Cairo,"Baron Empain's palace, with its Indian style and tower, stands out in the desert landscape, distinct from the rest of the city. The palace reflects the high status of its owner and marks a major milestone in the urban landscape of Heliopolis. Baron Empain's palace is the most prominent of monuments in the capital, its unique and innovative image attracts crowds of pedestrians on the road.
It was founded by Edward Louis Joseph Empain between 1907 and 1911. He was a Belgian businessman who was awarded the title ""Baron"" by the King of Belgium on account of his economic contributions. The French architect Alexander Marcel was tasked with building this masterpiece.
The interior design of the palace consists of a basement and two floors topped by a roof. The palace is surrounded by a large garden from all sides. As for the basement, it contained a residence for the palace's servants, and consisted of a group of rooms connected by corridors
and doors. The palace building is surrounded by a spiral staircase and an elevator that connects all the palace floors with the basement.
The ground floor consists of a reception room, a dining room, and a billiard room. As for the first floor, it houses four rooms, each with its own balcony and bathroom.  Finally, the roof of the palace comes as an open space on one of the sides of the tower, characteristic of the Baron Palace.
 ",09:00 AM,06:00 PM,"FOREIGNERS:
Adult: EGP 220 / Student: EGP110
EGYPTIANS:
Adult: EGP 60 / Student: EGP 30

- The Roof
Foreigners: EGP 120
Egyptians: EGP 30"
